{
  "protocolVersion": "1.0",
  "documentId": "doc_update",
  "documentVersionId": "docv_update_1",
  "projectId": "project_tju_demo",
  "version": 1,
  "contentHash": "sha256:161617336d51108b4a3f999eb1474a16327cd1de735d0afe6608a0f775ad2e95",
  "mimeType": "text/plain",
  "sourceName": "company-profile-v2.txt",
  "language": "zh-CN",
  "createdAt": "2025-01-10T08:00:00Z",
  "blocks": [
    {
      "blockId": "b001",
      "index": 0,
      "type": "heading",
      "text": "天津智造科技有限公司 2025 年度更新",
      "location": {
        "kind": "paragraph",
        "paragraphIndex": 0
      }
    },
    {
      "blockId": "b002",
      "index": 1,
      "type": "paragraph",
      "text": "本年度补充说明：公司研发人员 55 人（以年末在册口径计）。",
      "location": {
        "kind": "paragraph",
        "paragraphIndex": 1
      }
    },
    {
      "blockId": "b003",
      "index": 2,
      "type": "paragraph",
      "text": "公司办公地点位于天津市滨海新区海河教育园区。",
      "location": {
        "kind": "paragraph",
        "paragraphIndex": 2
      }
    }
  ],
  "parseInfo": {
    "parser": "synthetic/fixture",
    "quality": "complete"
  }
}
